{
  "schema_version": "agentteam_taskpack_blueprint.v1",
  "blueprint_id": "phase2-cleanup-replay-recovery",
  "source_plan": "experiments/native_agentteam_runtime/implementation_artifacts/plans/2026-07-27-phase2-experiment-harness-and-calibration.md",
  "research_authority": "experiments/native_agentteam_runtime/research/agentteam_research_positioning.md",
  "schema_inventory": [
    "experiments/native_agentteam_runtime/schemas/phase2_calibration.schema.json",
    "experiments/native_agentteam_runtime/schemas/phase2_contract_review.schema.json",
    "experiments/native_agentteam_runtime/schemas/phase2_readiness_promotion.schema.json",
    "experiments/native_agentteam_runtime/schemas/taskpack_blueprint.schema.json"
  ],
  "taskpack": {
    "taskpack_id": "phase2-cleanup-replay-recovery",
    "goal_kind": "implementation",
    "milestone": "research-phase-2-cleanup-recovery",
    "goal": "Complete P2-05C by deleting only the disposable clean snapshot after terminal sealing while preserving digest-bound historical replay for deterministic calibration and gate recomputation.",
    "overall_risk": "L2",
    "integration_policy": "verified integration baseline followed by operator review; never merge, push, activate a candidate release, execute P2-08, or call a live provider"
  },
  "contract": {
    "authority_model": "approved_phase2_v4_contract_plus_verified_p2_map_and_p2_05r_prefix_plus_observed_integration_failures",
    "recovery_source_commit": "5a06f6c9c2a2e54444a315e54feb1651d4fdd63d",
    "failed_run": "phase2-experiment-harness-recovery",
    "failed_task": "P2-05C",
    "failed_attempts": [
      "P2-05C-ATTEMPT-001",
      "P2-05C-ATTEMPT-002"
    ],
    "failure_contract": {
      "observed_errors": [
        "deterministic calibration rejected a deleted repository mount source",
        "readiness capability reruns could not discover a newly added cleanup schema before integration commit"
      ],
      "infrastructure_repair": "release phase2-cleanup-recovery-5a06f6c registers added paths in the Git inventory before integration verification",
      "remaining_code_repair": "separate live sandbox validation from digest-bound historical replay validation without weakening live execution"
    },
    "cleanup_policy": "seal and validate terminal result first; remove only run_dir/repository; publish a separate immutable cleanup receipt; revalidate sealed result digest after cleanup",
    "historical_replay_policy": "post-cleanup calibration may consume only immutable, digest-bound terminal lifecycle and sandbox evidence; it must not require the disposable mount source to remain present",
    "live_validation_policy": "all prelaunch and live provider paths continue requiring existing isolated mount sources and complete namespace denial evidence",
    "schema_policy": "the cleanup receipt schema is a tracked runtime resource and must be discoverable in copied or reconstructed repositories",
    "promotion_policy": "P2-08, live calibration, candidate release promotion, source merge, and push remain forbidden",
    "write_scope_cardinality_policy": {
      "default_max_entries": 9,
      "exact_path_exceptions": {
        "P2-05C-R": 9
      },
      "exception_scope_rule": "all production, schema, and test paths are exact",
      "exception_verification": "focused cleanup, calibration, and readiness tests plus full runtime suite"
    }
  },
  "approval": {
    "record_path": "experiments/native_agentteam_runtime/implementation_artifacts/reviews/phase2-cleanup-replay-contract-review.v1.json",
    "schema_path": "experiments/native_agentteam_runtime/schemas/phase2_contract_review.schema.json",
    "required_decision": "approved",
    "git_object_format_required": true,
    "runtime_release_binding_required": true,
    "digest_bindings": [
      "source_plan",
      "blueprint",
      "research_authority",
      "review_schema",
      "contract",
      "schema_inventory"
    ]
  },
  "agents": [
    {
      "agent_id": "agent-implementation-worker-1",
      "role": "implementation_worker",
      "runtime_profile": {
        "adapter": "codex"
      }
    }
  ],
  "verification": {
    "command": [
      "python3",
      "-m",
      "unittest",
      "discover",
      "-s",
      "experiments/native_agentteam_runtime/m0_runtime/tests",
      "-p",
      "test*.py"
    ],
    "success_criteria": [
      "The complete runtime suite passes on the integration baseline.",
      "The disposable repository is absent after successful finalization.",
      "The sealed terminal result and cleanup receipt remain immutable and digest-valid.",
      "Deterministic calibration and readiness relation reruns pass after cleanup without a live provider.",
      "Live sandbox validation still rejects missing mount sources.",
      "P2-08 is not executed and no source branch is merged or pushed."
    ]
  },
  "policy": {
    "semantic_authority": "approved Phase 2 v4 architecture decisions plus this failure-recovery contract",
    "task_generation": "disabled",
    "repo_map_policy": "consume the committed Phase 2 handoff and inspect only declared read scope",
    "trace_policy": "one L2 task result plus milestone integration report",
    "merge_policy": "integration baseline only; operator controls source merge",
    "network_policy": "no live provider calls"
  },
  "tasks": [
    {
      "task_id": "P2-05C-R",
      "objective": "Implement production clean-snapshot cleanup and durable receipt evidence while making sealed post-cleanup sandbox and invocation evidence replayable by deterministic calibration and readiness gates.",
      "goal_alignment": "Repairs the exact P2-05C integration failures without weakening live isolation or deferring cleanup.",
      "work_type": "code_implementation",
      "required_role": "implementation_worker",
      "backlog_status": "ready",
      "risk_target": "L2",
      "depends_on": [],
      "blockers": [],
      "read_scope": [
        "experiments/native_agentteam_runtime/implementation_artifacts/handoffs/phase2-repo-map-handoff.json",
        "experiments/native_agentteam_runtime/implementation_artifacts/plans/2026-07-29-phase2-experiment-harness-recovery.blueprint.json",
        "experiments/native_agentteam_runtime/m0_runtime/agentteam_runtime/experiment_modes.py",
        "experiments/native_agentteam_runtime/m0_runtime/agentteam_runtime/experiment_workspace.py",
        "experiments/native_agentteam_runtime/m0_runtime/agentteam_runtime/experiment_results.py",
        "experiments/native_agentteam_runtime/m0_runtime/agentteam_runtime/experiment_sandbox.py",
        "experiments/native_agentteam_runtime/m0_runtime/agentteam_runtime/experiment_calibration.py",
        "experiments/native_agentteam_runtime/m0_runtime/agentteam_runtime/projection_db.py",
        "experiments/native_agentteam_runtime/m0_runtime/tests/test_experiment_harness.py"
      ],
      "write_scope": [
        "experiments/native_agentteam_runtime/m0_runtime/agentteam_runtime/experiment_modes.py",
        "experiments/native_agentteam_runtime/m0_runtime/agentteam_runtime/experiment_workspace.py",
        "experiments/native_agentteam_runtime/m0_runtime/agentteam_runtime/experiment_results.py",
        "experiments/native_agentteam_runtime/m0_runtime/agentteam_runtime/experiment_sandbox.py",
        "experiments/native_agentteam_runtime/m0_runtime/agentteam_runtime/experiment_calibration.py",
        "experiments/native_agentteam_runtime/m0_runtime/agentteam_runtime/projection_db.py",
        "experiments/native_agentteam_runtime/m0_runtime/tests/test_experiment_harness.py",
        "experiments/native_agentteam_runtime/schemas/experiment_clean_snapshot_cleanup.schema.json"
      ],
      "required_deliverables": [
        "production_cleanup_call",
        "immutable_cleanup_receipt",
        "sealed_result_binding",
        "cleanup_failure_evidence",
        "receipt_derived_projection_status",
        "historical_sandbox_replay_validation",
        "live_sandbox_validation_preserved"
      ],
      "acceptance_criteria": [
        "The common finalizer seals and validates the terminal result before cleanup starts.",
        "Cleanup removes only run_dir/repository and revalidates the sealed result digest afterwards.",
        "A schema-valid immutable receipt binds run identity, sealed result digest, pre/post digest, and removed, already_absent, or failed status.",
        "Cleanup failure preserves the terminal result and is visible in projection, show, and comparison; a missing receipt remains incomplete.",
        "Post-cleanup deterministic calibration and readiness relation reruns validate digest-bound historical sandbox evidence without requiring deleted mount sources.",
        "Prelaunch and live sandbox loaders still reject missing mount sources and cannot opt into historical replay mode.",
        "Focused cleanup, calibration, live-validation, and readiness tests pass before the complete runtime suite."
      ],
      "stop_condition": "Stop if the solution mutates the sealed result, retains the disposable snapshot, skips calibration or gate recomputation, or weakens live provider mount validation.",
      "input_artifacts": [
        "experiments/native_agentteam_runtime/implementation_artifacts/plans/2026-07-30-phase2-cleanup-replay-recovery.blueprint.json",
        "experiments/native_agentteam_runtime/implementation_artifacts/handoffs/phase2-repo-map-handoff.json"
      ],
      "evidence_paths": [
        "experiments/native_agentteam_runtime/m0_runtime/tests/test_experiment_harness.py"
      ]
    }
  ]
}
